p.id,p.title,p.year,p.venue,p.venuetype,p.keyword,p.doi,p.abstract,p.notes,f.cat0,f.cat1,f.cat2,f.uc0,f.uc1,f.uc2,f.user,d.source,d.vgi,d.official,d.reference,a.type,a.collec,a.prep1,a.prep2,a.prep3,a.analysis1,a.analysis2,a.analysis3,a.viz,a.tool
p03,A demographic analysis of online sentiment during hurricane Irene,2012,Workshop on Language in Social Media,conference,NA,http://dl.acm.org/citation.cfm?id=2390378,"We examine the response to the recent natural disaster Hurricane Irene on Twitter.com. We collect over 65,000 Twitter messages relating to Hurricane Irene from August 18th to August 31st, 2011, and group them by location and gender. We train a sentiment classifier to categorize messages based on level of concern, and then use this classifier to investigate demographic differences.We report three principal findings: (1) the number of Twitter messages related to Hurricane Irene in directly affected regions peaks around the time the hurricane hits that region; (2) the level of concern in the days leading up to the hurricane?s arrival is dependent on region; and (3) the level of concern is dependent on gender, with females being more likely to express concern than males. Qualitative linguistic variations further support these differences. We conclude that social media analysis provides a viable, real-time complement to traditional survey methods for understanding public perception towards an impending disaster.",,data-centric,data preparation,topic classification,natural disaster,hurricanes,2011 Irene hurricane,public agencies,Twitter,,yes,demographic data,exploratory,api,Inferring gender user (matching againsts Census most polular names) and location (state level manualy),,,,,,,no
p03,A demographic analysis of online sentiment during hurricane Irene,2012,Workshop on Language in Social Media,conference,NA,http://dl.acm.org/citation.cfm?id=2390378,"We examine the response to the recent natural disaster Hurricane Irene on Twitter.com. We collect over 65,000 Twitter messages relating to Hurricane Irene from August 18th to August 31st, 2011, and group them by location and gender. We train a sentiment classifier to categorize messages based on level of concern, and then use this classifier to investigate demographic differences.We report three principal findings: (1) the number of Twitter messages related to Hurricane Irene in directly affected regions peaks around the time the hurricane hits that region; (2) the level of concern in the days leading up to the hurricane?s arrival is dependent on region; and (3) the level of concern is dependent on gender, with females being more likely to express concern than males. Qualitative linguistic variations further support these differences. We conclude that social media analysis provides a viable, real-time complement to traditional survey methods for understanding public perception towards an impending disaster.",,human-centric,human perception,level of concerns,natural disaster,hurricanes,2011 Irene hurricane,public agencies,Twitter,,yes,demographic data,exploratory,api,,,,,Sentiment classifier (bag-of-word model),,,no
p06,Improved Response to Disasters and Outbreaks by Tracking Population Movements with Mobile Phone Network Data: A Post-Earthquake Geospatial Study in Haiti,2011,Plos Medicine,journal,NA,http://dx.doi.org/10.1371/journal.pmed.1001083,"Background Population movements following disasters can cause important increases in morbidity and mortality. Without knowledge of the locations of affected people, relief assistance is compromised. No rapid and accurate method exists to track population movements after disasters. We used position data of subscriber identity module (SIM) cards from the largest mobile phone company in Haiti (Digicel) to estimate the magnitude and trends of population movements following the Haiti 2010 earthquake and cholera outbreak. Methods and Findings Geographic positions of SIM cards were determined by the location of the mobile phone tower through which each SIM card connects when calling. We followed daily positions of SIM cards 42 days before the earthquake and 158 days after. To exclude inactivated SIM cards, we included only the 1.9 million SIM cards that made at least one call both pre-earthquake and during the last month of study. In Port-au-Prince there were 3.2 persons per included SIM card. We used this ratio to extrapolate from the number of moving SIM cards to the number of moving persons. Cholera outbreak analyses covered 8 days and tracked 138,560 SIM cards. An estimated 630,000 persons (197,484 Digicel SIM cards), present in Port-au-Prince on the day of the earthquake, had left 19 days post-earthquake. Estimated net outflow of people (outflow minus inflow) corresponded to 20% of the Port-au-Prince pre-earthquake population. Geographic distribution of population movements from Port-au-Prince corresponded well with results from a large retrospective, population-based UN survey. To demonstrate feasibility of rapid estimates and to identify areas at potentially increased risk of outbreaks, we produced reports on SIM card movements from a cholera outbreak area at its immediate onset and within 12 hours of receiving data. Conclusions Results suggest that estimates of population movements during disasters and outbreaks can be delivered rapidly and with potentially high validity in areas with high mobile phone use.",,human-centric,human mobility,population flows,natural disaster,earthquakes,2012 Haiti earthquake,emergency managers,GPS data from mobile phone,user position,no,,exploratory,traces and stores geographic position for each mobile phone caller,,,,,,,basic mapping,no
p07,Location Extraction From Disaster-Related Microblogs,2013,International conference on World Wide Web companion,conference,location extraction; named entity recognition; social media mining,http://www2013.org/companion/p1017.pdf,,Location-aware NER tools assessment,data-centric,data preparation,location selection,natural disaster,NA,NA,NA,Twitter,,no,,exploratory,api,,"Named Entity Recognition (location, POI)",,,,,,no
p11,Rapid Aerial Mapping with Multiple Heterogeneous Unmanned Vehicles,2013,International ISCRAM Conference,conference,"crisis management; aerial situation image; unmanned aerial vehicles; complete coverage path planning 
",http://www.iscramlive.org/ISCRAM2013/files/211.pdf,,Partitioning method for efficient area coverage,crisis-centric,crisis management (recovery and response),collective damage assessment,natural disaster,NA,NA,response agencies,Unmaned  aerial vehicles,,no,,exploratory,,,,,,,Partition of the area into pieces proportional to the capabilities of UAVs to generate flights pla,,no
p12,Social Web in Disaster Archives,2012,Workshop on Social Web for Disaster Management (WWW),conference,social web; disaster management; digital archives,http://www2012.org/proceedings/companion/p715.pdf,,,data-centric,data preservation,curation,natural disaster,earthquakes,2011 Japan Earthquake,researchers,Social web sites,,no,,methodological,,,,,,,,,no
p13,Text vs. Images: On the Viability of Social Media to Assess Earthquake Damage,2013,International conference on World Wide Web companion,conference,social media; damage assessment; attenuation pattern,http://www2013.org/companion/p1003.pdf,,,crisis-centric,crisis management (monitoring),variables monitoring,natural disaster,earthquakes,2011 Tohoku Japan earthquake; 2011 New Zealand Christchurch earthquake,response agencies,Twitter,text-only tweets and media-containing tweets,no,,exploratory,api,,,,,,tweet density per grid cell plus circular buffer for computing intensity attenuation ,,no
p14,Twitter in mass emergency: what NLP techniques can contribute,2010,Workshop on Computational Linguistics in a World of Social Media,conference,NA,http://dl.acm.org/citation.cfm?id=1860679,"We detail methods for entity span identification and entity class annotation of Twitter communications that take place during times of mass emergency. We present our motivation, method and preliminary results.",,data-centric,data preparation,topic selection,natural disaster,NA,NA,NA,Twitter,,no,,exploratory,,,Named Entity Recognition; information extraction,,,,,,no
p16,Dynamic adaptive disaster simulation: developing a predictive model of emergency behavior using cell phone and GIS data,2011,Symposium on Agent-Directed Simulations,conference,gis; agent-based; emergency response; cell phone,http://www3.nd.edu/~dddas/Papers/ResearchPaperFrancisChen.pdf,,,human-centric,human mobility,mobility patterns,natural disaster,NA,NA,emergency managers,Synthetic data ,user position,no,,predictive,,,,,,,Predicting movements by computing Manhattan distance,geovisual analytics,no
p17,Social Media Text Mining and Network Analysis for Decision Support in Natural Crisis Management,2013,International ISCRAM Conference,conference,decision support; social media; text mining; web mining; link analysis; VGI; location extraction,http://www.iscramlive.org/ISCRAM2013/files/228.pdf,,,data-centric,data preparation,topic classification,natural disaster,hurricanes,2012 Tsunami Philippine; 2012 Hurricane Sandy,emergency managers,Twitter,,no,,exploratory,API enriched with most popular keywords,,multiligual classifiers,,,,,,no
p17,Social Media Text Mining and Network Analysis for Decision Support in Natural Crisis Management,2013,International ISCRAM Conference,conference,decision support; social media; text mining; web mining; link analysis; VGI; location extraction,http://www.iscramlive.org/ISCRAM2013/files/228.pdf,,,data-centric,data preparation,location selection,natural disaster,hurricanes,2012 Tsunami Philippine; 2012 Hurricane Sandy,emergency managers,Twitter,,no,,exploratory,API enriched with most popular keywords,,,geo-parsing,,,,,no
p17,Social Media Text Mining and Network Analysis for Decision Support in Natural Crisis Management,2013,International ISCRAM Conference,conference,decision support; social media; text mining; web mining; link analysis; VGI; location extraction,http://www.iscramlive.org/ISCRAM2013/files/228.pdf,,,crisis-centric,crisis management (monitoring),event-relevant extraction,natural disaster,hurricanes,2012 Tsunami Philippine; 2012 Hurricane Sandy,emergency managers,Twitter,,no,,exploratory,API enriched with most popular keywords,,,,"Trustworthiness SNA (indegree, outdegree, betweness)",,,,no
p18,Spatial video data collection in a post-disaster landscape: The Tuscaloosa Tornado of April 27th 2011,2012,Applied Geography,journal,gis; spatial video; disasters; recovery; tornado,http://www.sciencedirect.com/science/article/pii/S0143622811001184,,,crisis-centric,crisis management (recovery and response),collective damage assessment,natural disaster,tornados,2011 Tuscaloosa Tornado,response agencies,Spatial video,,no,,descriptive,,,,,,,gis tools,,no
p19,Using Service-Based GIS to Support Earthquake Research and Disaster Response,2012,Computing in Science and Engineering,journal,gis; cloud computing; earthquake; scientific computing; service-oriented architecture,http://ieeexplore.ieee.org/stamp/stamp.jsp?tp=&arnumber=6193083,,SOA-based OGC services framework,crisis-centric,crisis management (recovery and response),collective damage assessment,natural disaster,earthquakes,NA,response agencies,Unmaned  aerial vehicles,UVASAR images,yes,GPS; seismicity; geometric fault models; UVA Synthetic Aperture Radar (UAVSAR); InSAR images,exploratory,,,,,,,OGC services; online GIS tools for image analysis,,yes
p19,Using Service-Based GIS to Support Earthquake Research and Disaster Response,2012,Computing in Science and Engineering,journal,gis; cloud computing; earthquake; scientific computing; service-oriented architecture,http://ieeexplore.ieee.org/stamp/stamp.jsp?tp=&arnumber=6193083,,SOA-based OGC services framework,data-centric,data quality,comparison with official data,natural disaster,earthquakes,NA,response agencies,Unmaned  aerial vehicles,UVASAR images,yes,GPS; seismicity; geometric fault models; UVA Synthetic Aperture Radar (UAVSAR); InSAR images,exploratory,,,,,,,,,yes
p21,CrisisTracker: Crowdsourced Social Media Curation for Disaster Awareness,2013,IBM Journal of Research and Development,journal,NA,http://dx.doi.org/10.1147/JRD.2013.2260692,"Victims, volunteers, and relief organizations are increasingly using social media to report and act on large-scale events, as witnessed in the extensive coverage of the 2010-2012 Arab Spring uprisings and 2011 Japanese tsunami and nuclear disasters. Twitter feeds consist of short messages, often in a nonstandard local language, requiring novel techniques to extract relevant situation awareness data. Existing approaches to mining social media are aimed at searching for specific information, or identifying aggregate trends, rather than providing narratives. We present CrisisTracker, an online system that in real time efficiently captures distributed situation awareness reports based on social media activity during large-scale events, such as natural disasters. CrisisTracker automatically tracks sets of keywords on Twitter and constructs stories by clustering related tweets on the basis of their lexical similarity. It integrates crowdsourcing techniques, enabling users to verify and analyze stories. We report our experiences from an 8-day CrisisTracker pilot deployment during 2012 focused on the Syrian civil war, which processed, on average, 446,000 tweets daily and reduced them to consumable stories through analytics and crowdsourcing. We discuss the effectiveness of CrisisTracker based on the usage and feedback from 48 domain experts and volunteer curators.",,data-centric,data preparation,topic selection,man-made disaster,civil wars,2012 Syrian civil war,decision makers,Twitter,,no,,exploratory,api,people annotate and curate rapid stream of tweets to form stories (crowd curation),,,,,,,yes
p21,CrisisTracker: Crowdsourced Social Media Curation for Disaster Awareness,2013,IBM Journal of Research and Development,journal,NA,http://dx.doi.org/10.1147/JRD.2013.2260692,"Victims, volunteers, and relief organizations are increasingly using social media to report and act on large-scale events, as witnessed in the extensive coverage of the 2010-2012 Arab Spring uprisings and 2011 Japanese tsunami and nuclear disasters. Twitter feeds consist of short messages, often in a nonstandard local language, requiring novel techniques to extract relevant situation awareness data. Existing approaches to mining social media are aimed at searching for specific information, or identifying aggregate trends, rather than providing narratives. We present CrisisTracker, an online system that in real time efficiently captures distributed situation awareness reports based on social media activity during large-scale events, such as natural disasters. CrisisTracker automatically tracks sets of keywords on Twitter and constructs stories by clustering related tweets on the basis of their lexical similarity. It integrates crowdsourcing techniques, enabling users to verify and analyze stories. We report our experiences from an 8-day CrisisTracker pilot deployment during 2012 focused on the Syrian civil war, which processed, on average, 446,000 tweets daily and reduced them to consumable stories through analytics and crowdsourcing. We discuss the effectiveness of CrisisTracker based on the usage and feedback from 48 domain experts and volunteer curators.",,data-centric,data contextualization,situational awareness,man-made disaster,civil wars,2012 Syrian civil war,decision makers,Twitter,,no,,exploratory,api,,word frequency (classifiers); story detection (clustering),,,,,,yes
p21,CrisisTracker: Crowdsourced Social Media Curation for Disaster Awareness,2013,IBM Journal of Research and Development,journal,NA,http://dx.doi.org/10.1147/JRD.2013.2260692,"Victims, volunteers, and relief organizations are increasingly using social media to report and act on large-scale events, as witnessed in the extensive coverage of the 2010-2012 Arab Spring uprisings and 2011 Japanese tsunami and nuclear disasters. Twitter feeds consist of short messages, often in a nonstandard local language, requiring novel techniques to extract relevant situation awareness data. Existing approaches to mining social media are aimed at searching for specific information, or identifying aggregate trends, rather than providing narratives. We present CrisisTracker, an online system that in real time efficiently captures distributed situation awareness reports based on social media activity during large-scale events, such as natural disasters. CrisisTracker automatically tracks sets of keywords on Twitter and constructs stories by clustering related tweets on the basis of their lexical similarity. It integrates crowdsourcing techniques, enabling users to verify and analyze stories. We report our experiences from an 8-day CrisisTracker pilot deployment during 2012 focused on the Syrian civil war, which processed, on average, 446,000 tweets daily and reduced them to consumable stories through analytics and crowdsourcing. We discuss the effectiveness of CrisisTracker based on the usage and feedback from 48 domain experts and volunteer curators.",,crisis-centric,crisis management (monitoring),event-relevant extraction,man-made disaster,civil wars,2012 Syrian civil war,decision makers,Twitter,,no,,exploratory,api,,,,,,,,yes
p22,Crowdsourcing Linked Open Data for Disaster Management,2011,"Terra Cognita Workshop on Foundations, Technologies and Applications of the Geospatial Web",conference,NA,http://iswc2011.semanticweb.org/fileadmin/iswc/Papers/Workshops/Terra/paper2.pdf,"This paper shows how Linked Open Data can ease the challenges of information triage in disaster response efforts. Recently, disaster management has seen a revolution in data collection. Local victims as well as people all over the world collect observations and make them available on the web. Yet, this crucial and timely information source comes unstructured. This hinders a processing and integration, and often a general consideration of this information. Linked Open Data is supported by number of freely available technologies, backed up by a large community in academia and it offers the opportunity to create flexible mash-up solutions. At hand of the Ushahidi Haiti platform, this paper suggests crowdsourced Linked Open Data. We take a look at the requirements, the tools that are there to meet these requirements, and suggest an architecture to enable non-experts to contribute Linked Open Data.",,data-centric,data contextualization,linked data,natural disaster,earthquakes,2012 Haiti earthquake,humanitarian agencies,SMS,Usahidi platform,no,,methodological,,people process unstructured observations into structured RDF-triples,,,,,,a facet-based browsing and map visualizations (SIMILE),no
p22,Crowdsourcing Linked Open Data for Disaster Management,2011,"Terra Cognita Workshop on Foundations, Technologies and Applications of the Geospatial Web",conference,NA,http://iswc2011.semanticweb.org/fileadmin/iswc/Papers/Workshops/Terra/paper2.pdf,"This paper shows how Linked Open Data can ease the challenges of information triage in disaster response efforts. Recently, disaster management has seen a revolution in data collection. Local victims as well as people all over the world collect observations and make them available on the web. Yet, this crucial and timely information source comes unstructured. This hinders a processing and integration, and often a general consideration of this information. Linked Open Data is supported by number of freely available technologies, backed up by a large community in academia and it offers the opportunity to create flexible mash-up solutions. At hand of the Ushahidi Haiti platform, this paper suggests crowdsourced Linked Open Data. We take a look at the requirements, the tools that are there to meet these requirements, and suggest an architecture to enable non-experts to contribute Linked Open Data.",,data-centric,data assessment,user-driven data assessment,natural disaster,earthquakes,2012 Haiti earthquake,humanitarian agencies,SMS,Usahidi platform,no,,methodological,,people process unstructured observations into structured RDF-triples,,,,,,,no
p23,Crowdsourcing earthquake damage assessment using remote sensing imagery,2011,Annals of Geophysics,journal,surveys; measurements and monitoring; instruments and techniques; seismic risk; seismology; data dissemination generation,http://www.annalsofgeophysics.eu/index.php/annals/article/view/5324,,,data-centric,data assessment,collective data assessment,natural disaster,earthquakes,2008 China Wenchuan earthquake,experts and non-expert people ,NA,,yes,remote-sensing data from DigitalGlobe and Geoeye,methodological,,people compare before-and-after high-resolution satellite images to assess building damage ,,,,,Web mapping tool for collaborative damage assessment,,no
p23,Crowdsourcing earthquake damage assessment using remote sensing imagery,2011,Annals of Geophysics,journal,surveys; measurements and monitoring; instruments and techniques; seismic risk; seismology; data dissemination generation,http://www.annalsofgeophysics.eu/index.php/annals/article/view/5324,,,crisis-centric,crisis management (recovery and response),collective damage assessment,natural disaster,earthquakes,2008 China Wenchuan earthquake,experts and non-expert people ,NA,,yes,remote-sensing data from DigitalGlobe and Geoeye,methodological,,people compare before-and-after high-resolution satellite images to assess building damage ,,,,,Web mapping tool for collaborative damage assessment,,no
p25,Earthquake Twitter,2010,Nature Geosciences,journal,NA,http://dx.doi.org/10.1038/ngeo832,Twitter messages offer first-hand accounts of earthquakes within minutes. Analyses of their content and geographic distribution can be a useful supplement to instrument-based estimates of quake location and magnitude.,it is a short commentary,crisis-centric,crisis management (detection and prediction),variables estimation,natural disaster,earthquakes,NA,geologists,Twitter,,no,,exploratory,,,,,,,web mapping  (ShakeMap),,yes
p26,Information Verification during Natural Disasters,2013,Workshop on Social Web for Disaster Management (WWW),conference,crowdsourcing; data verification,http://irevolution.files.wordpress.com/2011/07/verily-swdmwww13.pdf,,,data-centric,data assessment,user-driven data assessment,natural disaster,NA,NA,humanitarian organizations; journalists; decision makers,Twitter,,no,,exploratory,,people engagement  (gamification) via recursive incentive mechanism to verify information,,,,,,basic mapping,no
p28,A Sensitive Twitter Earthquake Detector,2013,International conference on World Wide Web companion,conference,crisis coordination; disaster management; situation awareness; social media,http://www2013.org/companion/p999.pdf,, GeoSpread indicator and SNA struture can be used as effective indicators for earthquake alerting ,crisis-centric,crisis management (detection and prediction),variables estimation,natural disaster,earthquakes,NA,emergency managers,Twitter,,no,,predictive,api,,,,,geoSpread measure; SNA structure (retweet percentage),geo-spread  process to calculate quake intensity,basic mapping,yes
p31,Automatic Identification of Crisis-Related Sub-events Using Clustering,2012,International conference on Machine Learning and Applications,conference,clustering; crisis management; sub-event detection,http://ieeexplore.ieee.org/stamp/stamp.jsp?tp=&arnumber=6406815,,,data-centric,data preparation,topic classification,natural and man-made disaster,hurricanes; riots,Oslo Bombing; UK riots; 2011 Irene hurricane,decision makers,Flickr; YouTube,geo-coded figures and videos,no,,exploratory,,,Word frequency; clustering based on cosine distance measure,,,,,basic mapping of clusters on OSM base layers,no
p31,Automatic Identification of Crisis-Related Sub-events Using Clustering,2012,International conference on Machine Learning and Applications,conference,clustering; crisis management; sub-event detection,http://ieeexplore.ieee.org/stamp/stamp.jsp?tp=&arnumber=6406815,,,data-centric,data preparation,location selection and classification,natural and man-made disaster,hurricanes; riots,Oslo Bombing; UK riots; 2011 Irene hurricane,decision makers,Flickr; YouTube,geo-coded figures and videos,no,,exploratory,,,,clustering based on geo-referenced centroid with Self-Organizing Maps ,,,,basic mapping of clusters on OSM base layers,no
p32,Comparing Web Feeds and Tweets for Emergency Management,2013,International conference on World Wide Web companion,conference,disaster management; situation awareness; social media,http://www2013.org/companion/p1007.pdf,,it gathers data from a range of sources,data-centric,data quality,actionable information,man-made disaster,wildfires,2013 Australia fires,emergency managers,Twitter,get processed Twitter data via ESA platform (http://esa.csiro.au),yes,"authorised web feeds (GML, JSON, GeoJSON, KML)",descriptive,ESA platform,,,,,,,hotspots mapping,no
p33,Crisis Information Management in the Web 3.0 Age,2012,International ISCRAM Conference,conference,emergency management; linked open data; social media; participatory sensing; crowdsourcing ,http://www.iscramlive.org/ISCRAM2012/proceedings/160.pdf,,,data-centric,data contextualization,semantic annotation,natural disaster,NA,NA,NA,NA,,no,,exploratory,IncidentReporter mobile app,people classify and annotate semantically and enrich links ,,,,,,,no
p38,Harvesting Geospatial Knowledge from Social Metadata,2010,International ISCRAM Conference,conference,geospatial metadata; ontology; geo-ontology; social annotation; social web; geotagging,http://www.iscram.org/ISCRAM2010/Papers/150-Intagorn_etal.pdf,,,data-centric,data preparation,location selection and classification,NA,NA,NA,NA,Flickr,image metadata,yes,GeoName ontology,exploratory,,,,Feature extraction (placename); place disambiguation; clustering,,,,basic mapping,no
