p.id,p.title,p.year,p.venue,p.venuetype,p.keyword,p.doi,p.abstract,p.notes,f.cat0,f.cat1,f.cat2,f.uc0,f.uc1,f.uc2,f.user,d.source,d.vgi,d.official,d.reference,a.type,a.collec,a.prep1,a.prep2,a.prep3,a.analysis1,a.analysis2,a.analysis3,a.viz,a.tool
p38,Harvesting Geospatial Knowledge from Social Metadata,2010,International ISCRAM Conference,conference,geospatial metadata; ontology; geo-ontology; social annotation; social web; geotagging,http://www.iscram.org/ISCRAM2010/Papers/150-Intagorn_etal.pdf,,,data-centric,data contextualization,reasoning on location,NA,NA,NA,NA,Flickr,image metadata,yes,GeoName ontology,exploratory,,,,,,,geospatial subsumption (convex hull) to reason about places ,basic mapping,no
p40,Location Inference using Microblogging Messages,2012,Workshop on Social Web for Disaster Management (WWW),conference,microblog; geolocation estimation; text analysis ,http://www2012.wwwconference.org/proceedings/companion/p687.pdf,,,data-centric,data preparation,location selection and classification,man-made disaster,NA,NA,response agencies,Twitter,text-only tweets without geo-tags but generated by Foursquare,no,,exploratory,api,,,Location Name Recognition (specialised NER),,,,,no
p40,Location Inference using Microblogging Messages,2012,Workshop on Social Web for Disaster Management (WWW),conference,microblog; geolocation estimation; text analysis ,http://www2012.wwwconference.org/proceedings/companion/p687.pdf,,,data-centric,data contextualization,reasoning on location,man-made disaster,NA,NA,response agencies,Twitter,text-only tweets without geo-tags but generated by Foursquare,no,,exploratory,api,,,,,,Location extraction and inferring based on user's past messages ,,no
p42,Mining Conversations of Geographically Changing Users,2012,Workshop on Social Web for Disaster Management (WWW),conference,geographic conversations,http://www2012.org/proceedings/companion/p667.pdf,,,human-centric,human activities,daily life activities habits,man-made disaster,NA,NA,response agencies,Twitter,,no,,exploratory,api,,,,,,geographic clustering (quadtree); location transition,,no
p43,SensePlace2: GeoTwitter analytics support for situational awareness,2011,International conference on Visual Analytics Science and Technology,conference,crisis management; geovisualization; scenario-based design; situational awareness; social media analytics; spatio-temporal analysis; text analytics,http://ieeexplore.ieee.org/stamp/stamp.jsp?tp=&arnumber=6102456,, geographically-grounded situational awareness; survey on current uses of social media,data-centric,data preparation,topic selection and classification,man-made disaster,NA,NA,response agencies,Twitter,,no,,exploratory,api,,"Named Entity Recognition (people, organizations, etc)",,,,,visual geographic-temporal-thematic overview,yes
p43,SensePlace2: GeoTwitter analytics support for situational awareness,2011,International conference on Visual Analytics Science and Technology,conference,crisis management; geovisualization; scenario-based design; situational awareness; social media analytics; spatio-temporal analysis; text analytics,http://ieeexplore.ieee.org/stamp/stamp.jsp?tp=&arnumber=6102456,, geographically-grounded situational awareness; survey on current uses of social media,data-centric,data preparation,geo-parsing,man-made disaster,NA,NA,response agencies,Twitter,,no,,exploratory,api,,,"Named Entity Recognition (place names, time) +  geo-coding (Geonames)",,,,visual geographic-temporal-thematic overview,yes
p43,SensePlace2: GeoTwitter analytics support for situational awareness,2011,International conference on Visual Analytics Science and Technology,conference,crisis management; geovisualization; scenario-based design; situational awareness; social media analytics; spatio-temporal analysis; text analytics,http://ieeexplore.ieee.org/stamp/stamp.jsp?tp=&arnumber=6102456,, geographically-grounded situational awareness; survey on current uses of social media,data-centric,data contextualization,situational awareness,man-made disaster,NA,NA,response agencies,Twitter,,no,,exploratory,api,,,,,,geo analysis; density surface maps (heatmaps),visual geographic-temporal-thematic overview,yes
p44,Social Media Data Mining: A Social Network Analysis Of Tweets During The 2010-2011 Australian Floods,2011,Pacific Asia conference on Information Systems,conference,social network analysis; text mining; social media; mass emergencies,http://alpha.nyit.edu/som/faculty/khoo/Spring2012/MIST760/Others/2011%20Social%20Media%20Data%20Mining-%20A%20Social%20Network%20Analysis%20Of%20Tweets%20During%20Aus%20Floods_ProcPACIS.pdf,,,human-centric,human relations,community formation,natural disaster,floodings,2010-2011 Australian floods,NA,Twitter,,no,,exploratory,api,,,,,"communities detection; centrality (key players); SNA structure properties (degree, closeness, eigenvector); user-resource network",,,no
p47,Top Health Trends: An information visualization tool for awareness of local health trends,2013,International ISCRAM Conference,conference,information visualization; health trends detection; situation awareness; social networking; decision aids,http://www.iscramlive.org/ISCRAM2013/files/185.pdf,,,data-centric,data preparation,topic selection and classification,man-made disaster,disease outbreaks,NA,public health agencies,Twitter,,no,,descriptive,api,,topic detection (illnesses),,,,,basic mapping,no
p47,Top Health Trends: An information visualization tool for awareness of local health trends,2013,International ISCRAM Conference,conference,information visualization; health trends detection; situation awareness; social networking; decision aids,http://www.iscramlive.org/ISCRAM2013/files/185.pdf,,,crisis-centric,crisis management (health),health trends detection,man-made disaster,disease outbreaks,NA,public health agencies,Twitter,,no,,descriptive,api,,topic detection (illnesses),,,,,basic mapping,no
p49,Twitcident: Fighting Fire with Information from Social Web Streams,2012,International conference on World Wide Web companion,conference,social web streams; filtering; faceted search; semantics,http://fabianabel.de/papers/2012-wis-www-twitcident.pdf,,,data-centric,data contextualization,semantic annotation,man-made disaster,wildfires,NA,NA,Twitter,,no,,exploratory,api,,classification and semantic profiling; linkage to external resources,,,,,,no
p51,A New Geospatial Services Framework: How Disaster Preparedness Efforts Should Integrate Neogeography,2012,"Journal of Map & Geography Libraries: Advances in Geospatial Information, Collections & Archives",journal,urban planning; disaster preparedness; neogeography; participatory planning; local government,http://www.tandfonline.com/doi/full/10.1080/15420353.2012.670084#.U7ufcvl_tUU,,,data-centric,data policies,access,natural and man-made disaster,hurricanes; riots,NA,response agencies,Multiple  sources ,,no,,descriptive,,,,,,,,basic mapping,no
p53,Demarcating new boundaries: mapping virtual polycentric communities through social media content,2013,Cartography and Geographic Information Science,journal,social media; Twitter; community detection; community mapping; statehood; Syria,http://css.gmu.edu/andrew/pubs/CaGIS.pdf,,,data-centric,data preparation,location selection and classification,man-made disaster,civil wars,geo-political scenario in Syria,geopolitics,Twitter,,no,,exploratory,api,,,word frequency,,,,basic mapping,no
p53,Demarcating new boundaries: mapping virtual polycentric communities through social media content,2013,Cartography and Geographic Information Science,journal,social media; Twitter; community detection; community mapping; statehood; Syria,http://css.gmu.edu/andrew/pubs/CaGIS.pdf,,,human-centric,human relations,community formation,man-made disaster,civil wars,geo-political scenario in Syria,geopolitics,Twitter,,no,,exploratory,api,,,,,,density surface maps (heatmaps),basic mapping,no
p55,Probing crowd density through smartphones in city-scale mass gatherings,2013,EPJ Data Science,journal,crowd sensing; pedestrian behavior; crowd density estimation; participatory sensing; smartphone,http://www.epjdatascience.com/content/2/1/5,,but it is a sound analysis,human-centric,human mobility,population flows,man-made disaster,NA,NA,NA,GPS data from mobile phone,user position,no,,inferential,voluntaries share their location ,,,,,"spatio-temporal-velocity distribution of recorded data; calculatation of crowd density; modelling/infer walking speed of pedestrians based on the crowd density (scatterplot, histogram, linear regression, residual analysis)",density surface maps (heatmaps),basic mapping,no
p57,#Earthquake: Twitter as a Distributed Sensor System,2013,Transactions in GIS,journal,NA,http://dx.doi.org/10.1111/j.1467-9671.2012.01359.x,"Social media feeds are rapidly emerging as a novel avenue for the contribution and dissemination of information that is often geographic. Their content often includes references to events occurring at, or affecting specific locations. Within this article we analyze the spatial and temporal characteristics of theÿtwitterÿfeed activity responding to a 5.8 magnitude earthquake which occurred on the East Coast of the United States (US) on August 23, 2011. We argue that these feeds represent a hybrid form of a sensor system that allows for the identification and localization of the impact area of the event. By contrasting this with comparable content collected through the dedicated crowdsourcing ?Did You Feel It?? (DYFI) website of the U.S. Geological Survey we assess the potential of the use of harvested social media content for event monitoring. The experiments support the notion that people act as sensors to give us comparable results in a timely manner, and can complement other sources of data to enhance our situational awareness and improve our understanding and response to such events.",,crisis-centric,crisis management (detection and prediction),variables estimation,natural disaster,earthquakes,2011 Mineral Earthquake,decision makers,Twitter,,yes,crowdsourcing ?Did You Feel It?? (DYFI) website of the U.S. Geological Survey,exploratory,api,,,,,,"Response pattern as function of distance from epicenter over time (histogram, etc.)",basic mapping,yes
p58,Inferring the Location of Twitter Messages Based on User Relationships,2011,Transactions in GIS,journal,NA,http://dx.doi.org/10.1111/j.1467-9671.2011.01297.x,"User interaction in social networks, such as Twitter and Facebook, is increasingly becoming a source of useful information on daily events. The online monitoring of short messages posted in such networks often provides insight on the repercussions of events of several different natures, such as (in the recent past) the earthquake and tsunami in Japan, the royal wedding in Britain and the death of Osama bin Laden. Studying the origins and the propagation of messages regarding such topics helps social scientists in their quest for improving the current understanding of human relationships and interactions. However, the actual location associated to a tweet or to a Facebook message can be rather uncertain. Some tweets are posted with an automatically determined location (from an IP address), or with a user-informed location, both in text form, usually the name of a city. We observe that most Twitter users opt not to publish their location, and many do so in a cryptic way, mentioning non-existing places or providing less specific place names (such as ?Brazil?). In this article, we focus on the problem of enriching the location of tweets using alternative data, particularly the social relationships between Twitter users. Our strategy involves recursively expanding the network of locatable users using following-follower relationships. Verification is achieved using cross-validation techniques, in which the location of a fraction of the users with known locations is used to determine the location of the others, thus allowing us to compare the actual location to the inferred one and verify the quality of the estimation. With an estimate of the precision of the method, it can then be applied to locationless tweets. Our intention is to infer the location of as many users as possible, in order to increase the number of tweets that can be used in spatial analyses of social phenomena. The article demonstrates the feasibility of our approach using a dataset comprising tweets that mention keywords related to dengue fever, increasing by 45% the number of locatable tweets.",,data-centric,data contextualization,reasoning on location,man-made disaster,disease outbreaks,Fewer outbreaks,emergency managers,Twitter,,no,,exploratory,api,"Compare precision and recall using different types of Twitter location (GeoIP, GPS, locaiton of one's followers)",,geo-parsing ,,,,,no
p58,Inferring the Location of Twitter Messages Based on User Relationships,2011,Transactions in GIS,journal,NA,http://dx.doi.org/10.1111/j.1467-9671.2011.01297.x,"User interaction in social networks, such as Twitter and Facebook, is increasingly becoming a source of useful information on daily events. The online monitoring of short messages posted in such networks often provides insight on the repercussions of events of several different natures, such as (in the recent past) the earthquake and tsunami in Japan, the royal wedding in Britain and the death of Osama bin Laden. Studying the origins and the propagation of messages regarding such topics helps social scientists in their quest for improving the current understanding of human relationships and interactions. However, the actual location associated to a tweet or to a Facebook message can be rather uncertain. Some tweets are posted with an automatically determined location (from an IP address), or with a user-informed location, both in text form, usually the name of a city. We observe that most Twitter users opt not to publish their location, and many do so in a cryptic way, mentioning non-existing places or providing less specific place names (such as ?Brazil?). In this article, we focus on the problem of enriching the location of tweets using alternative data, particularly the social relationships between Twitter users. Our strategy involves recursively expanding the network of locatable users using following-follower relationships. Verification is achieved using cross-validation techniques, in which the location of a fraction of the users with known locations is used to determine the location of the others, thus allowing us to compare the actual location to the inferred one and verify the quality of the estimation. With an estimate of the precision of the method, it can then be applied to locationless tweets. Our intention is to infer the location of as many users as possible, in order to increase the number of tweets that can be used in spatial analyses of social phenomena. The article demonstrates the feasibility of our approach using a dataset comprising tweets that mention keywords related to dengue fever, increasing by 45% the number of locatable tweets.",,crisis-centric,crisis management (health),health trends detection,man-made disaster,disease outbreaks,Fewer outbreaks,emergency managers,Twitter,,no,,exploratory,api,"Compare precision and recall using different types of Twitter location (GeoIP, GPS, locaiton of one's followers)",,geo-parsing ,,,,,no
p59,Geo-parsing Messages from Microtext,2011,Transactions in GIS,journal,NA,http://dx.doi.org/10.1111/j.1467-9671.2011.01294.x,"Widespread use of social media during crises has become commonplace, as shown by the volume of messages during the Haiti earthquake of 2010 and Japan tsunami of 2011. Location mentions are particularly important in disaster messages as they can show emergency responders where problems have occurred. This article explores the sorts of locations that occur in disaster-related social messages, how well off-the-shelf software identifies those locations, and what is needed to improve automated location identification, called geo-parsing. To do this, we have sampled Twitter messages from the February 2011 earthquake in Christchurch, Canterbury, New Zealand. We annotated locations in messages manually to make a gold standard by which to measure locations identified by a Named Entity Recognition software. The Stanford NER software found some locations that were proper nouns, but did not identify locations that were not capitalized, local streets and buildings, or non-standard place abbreviations and mis-spellings that are plentiful in microtext. We review how these problems might be solved in software research, and model a readable crisis map that shows crisis location clusters via enlarged place labels.",,data-centric,data preparation,location selection and classification,natural disaster,earthquakes,2011 New Zealand Christchurch earthquake ,NA,Twitter,,no,,exploratory,api,manual annotation of location to create a gold standard (training set),automated annotation of location using Name Entity Recognition and geo-referencing services,"geo-parsing, i.e.  use of geo-referencing services",,,,basic mapping,no
p60,Inferring social ties from geographic coincidences,2011,PNAS,journal,computer science; privacy; probabilistic models; social networks,http://www.pnas.org/content/early/2010/12/02/1006155107.full.pdf,,,data-centric,data preparation,location selection and classification,NA,NA,NA,NA,Flickr,geo-taggged photos,no,,inferential,api,,,geo-parsing,,,,,no
p60,Inferring social ties from geographic coincidences,2011,PNAS,journal,computer science; privacy; probabilistic models; social networks,http://www.pnas.org/content/early/2010/12/02/1006155107.full.pdf,,,human-centric,human activities,people colocation,NA,NA,NA,NA,Flickr,geo-taggged photos,no,,inferential,api,,,,SNA - link analysis,Probabilistic models,,,no
p62,Leveraging Explicitly Disclosed Location Information to Understand Tourist Dynamics: A Case Study,2008,Journal of Location-based Services,journal,spatio-temporal data analysis; geovisualization; location-discloure; location-based services,http://www.girardin.org/fabien/publications/girardin_dalfiore_ratti_blat_jlbs_final_pre_editing.pdf,,,human-centric,human activities,daily life activities habits,man-made disaster,crowded areas,province of Florence,local authorities; tourism agencies,Flickr,geo-taggged information from EXIF mentadata embedded in photo files,no,,exploratory,api,,,,SNA - link analysis,,,geovisualizations for heatmaps and spatio-temporal flow animations,no
p62,Leveraging Explicitly Disclosed Location Information to Understand Tourist Dynamics: A Case Study,2008,Journal of Location-based Services,journal,spatio-temporal data analysis; geovisualization; location-discloure; location-based services,http://www.girardin.org/fabien/publications/girardin_dalfiore_ratti_blat_jlbs_final_pre_editing.pdf,,,human-centric,human mobility,mobility patterns,man-made disaster,crowded areas,province of Florence,local authorities; tourism agencies,Flickr,geo-taggged information from EXIF mentadata embedded in photo files,no,,exploratory,api,,,,,,spatiotemporal inbound and outbound flow of tourists (concentration and movement patterns) ,geovisualizations for heatmaps and spatio-temporal flow animations,no
p67,Geosocial gauge: a system prototype for knowledge discovery from social media,2013,International Journal of Geographical Information Science,journal,social media; geosocial analysis; social network analysis; event monitoring; system architecture,http://www.tandfonline.com/doi/abs/10.1080/13658816.2013.825724#.U7-RY_l_tUU,,,human-centric,human relations,community formation,man-made disaster,riots,US political crisis,NA,Twitter; Flickr,,no,,exploratory,api,,,,"SNA structure (popular contributors, bridge nodes); network visualizations",,geosocial media data model,basic mapping,no
p70,Automated geographic context analysis for volunteered information,2013,Applied Geography,journal,volunteered geographic information; social media; spatial data infrastructures; spatio-temporal clustering; geographic context analysis,http://www.sciencedirect.com/science/article/pii/S0143622813001185,,VGI contextualization,data-centric,data preparation,topic selection and classification,man-made disaster,wildfires,NA,response agencies,Twitter; Flickr,,yes,EFFIS hotspot data; EMM; CORINE data; MODIS data,exploratory,api,manual geo-coding evaluation,topic detencion; classification; clustering ,,,,spatio-temporal clustering,basic mapping,yes
p70,Automated geographic context analysis for volunteered information,2013,Applied Geography,journal,volunteered geographic information; social media; spatial data infrastructures; spatio-temporal clustering; geographic context analysis,http://www.sciencedirect.com/science/article/pii/S0143622813001185,,VGI contextualization,data-centric,data preparation,location selection,man-made disaster,wildfires,NA,response agencies,Twitter; Flickr,,yes,EFFIS hotspot data; EMM; CORINE data; MODIS data,exploratory,api,,,geo-parsing,,,spatio-temporal clustering,basic mapping,yes
p70,Automated geographic context analysis for volunteered information,2013,Applied Geography,journal,volunteered geographic information; social media; spatial data infrastructures; spatio-temporal clustering; geographic context analysis,http://www.sciencedirect.com/science/article/pii/S0143622813001185,,VGI contextualization,data-centric,data contextualization,context enrichment,man-made disaster,wildfires,NA,response agencies,Twitter; Flickr,,yes,EFFIS hotspot data; EMM; CORINE data; MODIS data,exploratory,api,,,combination of social and official data to produce relevant actionable information ,,,spatio-temporal clustering,basic mapping,yes
p70,Automated geographic context analysis for volunteered information,2013,Applied Geography,journal,volunteered geographic information; social media; spatial data infrastructures; spatio-temporal clustering; geographic context analysis,http://www.sciencedirect.com/science/article/pii/S0143622813001185,,VGI contextualization,data-centric,data quality,comparison with official data,man-made disaster,wildfires,NA,response agencies,Twitter; Flickr,,yes,EFFIS hotspot data; EMM; CORINE data; MODIS data,exploratory,api,,,geo-context scoring,,,spatio-temporal clustering,basic mapping,yes
p71,Thematic Patterns in Georeferenced Tweets through Space-Time Visual Analytics,2013,Computing in Science and Engineering,journal,georeferencing; scientific computing; visual analytics,http://ieeexplore.ieee.org/xpl/articleDetails.jsp?reload=true&arnumber=6550013,,,data-centric,data preparation,topic selection and classification,man-made disaster,crowded areas,Seattle city,city planners,Twitter,,yes,US Census (population density),exploratory,api,distinguish manually between locals and visitors tweets,topic detection; classifiers; word frequency; clustering,,,,,basic mapping; tagcloud visualization,no
p71,Thematic Patterns in Georeferenced Tweets through Space-Time Visual Analytics,2013,Computing in Science and Engineering,journal,georeferencing; scientific computing; visual analytics,http://ieeexplore.ieee.org/xpl/articleDetails.jsp?reload=true&arnumber=6550013,,,human-centric,human activities,daily life activities habits,man-made disaster,crowded areas,Seattle city,city planners,Twitter,,yes,US Census (population density),exploratory,api,distinguish manually between locals and visitors tweets,,,,,spatio-temporal cluster; spatio-temporal distances; voronoi calculation,basic mapping; tagcloud visualization,no
p73,Finding and assessing social media information sources in the context of journalism,2012,International conference on Human Factors in Computing Systems,conference,"computational journalism; social media; news events 
",http://dl.acm.org/citation.cfm?id=2208409,,,data-centric,data preparation,topic selection and classification,man-made disaster,riots,NA,journalists,Twitter,,no,,exploratory,api,,Named Entity Recognition; word frequency; classifiers,,,,,basic mapping,yes
p73,Finding and assessing social media information sources in the context of journalism,2012,International conference on Human Factors in Computing Systems,conference,"computational journalism; social media; news events 
",http://dl.acm.org/citation.cfm?id=2208409,,,data-centric,data contextualization,reasoning on location,man-made disaster,riots,NA,journalists,Twitter,,no,,exploratory,api,,,geo-parsing; aggregate location information from one's friend network to identify the most prevalent location of an user,,,,basic mapping,yes
p73,Finding and assessing social media information sources in the context of journalism,2012,International conference on Human Factors in Computing Systems,conference,"computational journalism; social media; news events 
",http://dl.acm.org/citation.cfm?id=2208409,,,data-centric,data quality,actionable information,man-made disaster,riots,NA,journalists,Twitter,,no,,exploratory,api,,,,,,Proximity to an event and user?s aggregate location are key aspect to verify social media sources,basic mapping,yes
